intitule,description,romeLibelle,competences,cosine_similarity
Expert Scientifique R&D Intelligence Artificielle (H/F),"À propos de nous : 

Nous sommes une équipe de médecins, de cadres de la santé, de scientifiques des données et d'experts en technologie qui s'engagent à donner à chacun, où qu'il soit, les informations dont il a besoin pour prendre des décisions éclairées en matière de soins de santé. Grâce à la puissance combinée de l'IA et du big data, nous avons créé la première solution tout-en-un qui fournit à nos utilisateurs tout ce qu'ils ont besoin de savoir sur les professionnels et les établissements médicaux. RYTE transforme les données complètes que nous recueillons sur des millions de prestataires de soins de santé et d'experts médicaux dans le monde entier en connaissances qui aident les individus et les organisations à naviguer dans les systèmes de santé. Basé à Toronto (Canada) et ayant des activités au Canada, en France, au Kazakhstan et aux Philippines, vous rejoindrez une équipe véritablement internationale, multiculturelle et dynamique, dont l'objectif est de construire quelque chose d'unique qui affecte la vie et les soins de santé à l'échelle mondiale. Pour plus d'informations sur nous, veuillez nous contacter à l'adresse www.ryte.ai. 

Nous recherchons un expert de l'IA et un penseur innovant pour rejoindre l'équipe de R&D afin d'avoir un impact significatif sur le secteur de l'analyse des soins de santé.

Il s'agit d'un poste d'encadrement à temps plein (CDI) en France (Paris). 

Le poste : Expert Scientifique R&D Intelligence Artificielle. 

Le rôle : 
En tant que membre de l'équipe de R&D, vous menerai des projets au sein d'une équipe d'ingénieurs en IA, d'architectes et de scientifiques de données situés dans plusieurs pays pour effectuer la recherche et le développement de solutions d'IA liées à l'analyse des soins de santé, en liaison avec les universités et les organisations mondiales.

Responsabilités : 
    Élaborer, exécuter et améliorer en permanence des plans globaux de recherche et de développement en étroite collaboration avec l'équipe IA et les partenaires de Ryte à l'échelle mondiale. 
    Instaurer une culture de l'innovation au sein de l'entreprise en encourageant l'innovation dans tous les domaines liés à l'IA.   
    Construire et exécuter une feuille de route AI/ML pour notre plateforme d'analyse des soins de santé. 
    Identifier les opportunités d'appliquer les dernières avancées en matière d'apprentissage automatique et d'intelligence artificielle pour construire, tester et valider des modèles prédictifs à la tête d'une équipe de data scientists. 
    Fournir un apprentissage automatique de premier ordre et une contribution stratégique aux projets et aux opérations en cours ; mener une réflexion et une planification stratégique pour la conception, la mise en œuvre et l'orientation des initiatives d'IA/ML et être en mesure d'enthousiasmer les chefs d'entreprise sur la base de la capacité à générer un impact commercial à l'aide de stratégies d'IA/ML. 
    Sensibilisation interne et stratégie d'adoption des méthodologies émergentes d'apprentissage automatique grâce à l'exécution d'un plan de communication efficace. 
    Travailler en partenariat avec l'ingénierie des données, les scientifiques des données et l'intendance des données pour contribuer à l'exécution d'une stratégie de données réussie.
Créer des algorithmes pour extraire des informations à partir de grands ensembles de données multiparamétriques globales. 
    Déployer des algorithmes en production afin d'identifier des informations exploitables à partir de grands ensembles de données. 
    Comparer les résultats de diverses méthodologies et recommander les meilleures techniques aux parties prenantes. 
    Concevoir, développer et mettre en œuvre des solutions analytiques à l'aide de divers outils commerciaux et open-source tels que Python, R, TensorFlow. 
    Développer et intégrer des processus automatisés et déploiement de modèles.","Management et ingénierie études, recherche et développement industriel","[{'code': '118500', 'libelle': 'Élaborer des propositions techniques', 'exigence': 'S'}, {'code': '119161', 'libelle': ""Identifier les contraintes d'un projet"", 'exigence': 'S'}, {'code': '124529', 'libelle': ""Déterminer des axes d'évolution technologiques"", 'exigence': 'S'}, {'code': '300337', 'libelle': ""Définir la stratégie financière d'une structure"", 'exigence': 'S'}, {'code': '300488', 'libelle': 'Concevoir et gérer un projet', 'exigence': 'S'}]",0.9571290016174316
Data-manager / Biostatisticien(ne) Senior (H/F),"Complife France est une société composée de deux centres (Brest et Lyon) qui fait partie du groupe international COMPLIFE. 
Prestataire de service pour l'industrie du bien-être et de la beauté, Complife France évalue la tolérance, la sécurité et l'efficacité de produits cosmétiques (soins, produits capillaires, maquillages, produit solaires ).

Rejoignez-nous sur le site de Lyon pour renforcer nos équipes.

Vous aurez la charge de :

DATA MANAGEMENT
-	Conduire efficacement avec autonomie, rigueur et dans le respect des standards internationaux (GCP, ICH, GCDMP) toutes les activités de gestion de données :
-	Participation à la rédaction du protocole études sur la partie data management 
-	Design des CRFs et/ou programmation eCRF
-	Rédaction des documents de référence (plan de Data Management, cahier de charges de validation des données et queries)
-	Extraction des données et contrôle
-	Programmation des contrôles de cohérence
-	Former des utilisateurs et gérer les accès à la base de données
-	Gérer les queries et les données externes
-	Préparer et animer les réunions de revue des données avant gel de base
-	Communiquer directement avec le chef de projets cliniques sur les aspects techniques et l'avancement des activités de Data Management.

STATISTIQUES
-	Rédiger et valider le plan d'analyse statistique des protocoles de recherche
-	Programmer et exécuter les analyses statistiques 
-	Valider les résultats en cas de sous-traitance

Profil recherché : 
-	Dynamisme, motivation, polyvalence, sens de l'organisation, autonomie, rigueur
-	Capacité relationnelle écrite et orale
-	Bon esprit d'équipe
-	Formation supérieure scientifique avec une spécialisation en Data Management ou Statistique
-	La maitrise de SAS, R ou d'un autre logiciel statistique et des standards est requise
-	Expérience d'au moins 5 ans en essais cliniques et/ou dispositifs médicaux (réglementations / directives internationales, des dispositions éthiques liées aux essais sur l'homme et de la protection connexe des données personnelles)
-	Bonne maitrise de l'anglais technico-scientifique écrit et oral

Horaires de travail : 
-	Temps plein : 35 heures/semaine
-	Les heures de travail devront s'effectuer selon les besoins sur la plage horaire suivante : 7h30 à 19h00.
-	Possibilité de déplacements en France ou à l'étranger",Expertise et support en systèmes d'information,"[{'code': '300195', 'libelle': ""Concevoir un logiciel, un système d'informations, une application"", 'exigence': 'E'}, {'code': '300488', 'libelle': 'Concevoir et gérer un projet', 'exigence': 'E'}, {'code': '300495', 'libelle': 'Évaluer le résultat de ses actions', 'exigence': 'S'}]",0.9570183753967285
Data manager (H/F),"Description du poste :
Rattaché à la Direction Systèmes d'Information (DSI), vous intégrez une équipe de 4 personnes. Votre rôle, consiste mettre en place la collecte et la mise à disposition des données au sein de l'entreprise, être en charge d'industrialiser et mettre en production des traitements sur les données (par exemple : mise à disposition de tableaux de bord, intégration de modèles statistiques) en lien avec les équipes métiers et les équipes qui les analysent.
C'est un rôle central et très important, situé au coeur de notre développement ! Le Data Engineer est le maillon essentiel pour fournir les données fiables aux métiers leur permettant de créer leurs nouveaux produits et services.
Les missions sont composées des actions suivantes ;
Acheminement de la donnée ;
- Recueillir les besoins métiers des différentes unités demandeuses et utilisatrices de solutions de collecte et stockage de la donnée.
- Développer les solutions techniques de collecte de la donnée via des API.
- Développer des solutions techniques de stockage de la donnée (Hadoop).
- Réaliser les tests unitaires et d'intégration.
- Mettre en place et maintenir les batchs, c'est-à-dire les automatisations d'une série de traitements.
Mise à disposition des données aux équipes utilisatrices ;
- Industrialiser et automatiser le nettoyage de la donnée selon les spécifications retenues.
- Gérer, maintenir et documenter de multiples bases de données (via l'importation de données externes en open data ou de données internes par exemple).
- Gérer le cycle de vie de la donnée conformément aux directives inscrites dans le RGPD.
- Assurer le suivi de production et la maintenance.
Mise en production de modèles statistiques dans les applications ;
- Développer l'industrialisation de modèles statistiques ou de machine learning.
- Implémentation du suivi de la validité du modèle statistique.
- Assurer le suivi de production et la maintenance.
Suivi des projets de développement ;
- Établir les spécifications techniques à partir de l'analyse des besoins.
- Reporter l'activité auprès du chef de projet. Autres activités éventuelles ;
- Automatiser la création de tableaux de bord aux équipes métiers (envoi de fichiers via des applications dédiées).
- Assurer une veille technologique sur les outils big data.
- Écrire la documentation relative aux bases de données (règles de gestion, dictionnaire des variables.).
Dans le cadre de sa politique diversité, le groupe Axéréal étudie, à compétences égales, toutes candidatures dont celles de personnes en situation de handicap.
Description du profil :
De formation Bac+5 école d'ingénieur orienté développement, ou master spécialisé en data, avec une spécialisation Big Data, vous êtes passionné par l'innovation et les technologies liées aux domaines Data Analytics & AI.
- Maîtrise de l'environnement technique du cloud provider (GCP )
- Maîtrise des bases de données (BigQuery)
- Maîtrise de langages de programmation (Java, Python, Spark, Scala, Sql,.)
- Maîtrise des outils de gestion de flux et de manipulation de données ETL/ELT (Semarchy DI, Google DataFlow, Dataproc, etc .)
- Connaissance des méthodes de développement agile
- Maîtrise des systèmes d'exploitation (Unix, Windows.)
Vous appréciez travailler en équipe et possédez un excellent relationnel ? C'est parfait, car le poste nécessite de travailler avec des interlocuteurs multiples et demande ainsi une grande adaptabilité.
Aussi, vos capacités organisationnelles, votre autonomie, votre sens de l'initiative, votre rigueur et votre orientation résultat sont autant d'atouts qui vous permettront d'exceller dans la fonction.",Expertise et support en systèmes d'information,,0.9564255475997925
Data analyst and Product Owner Delegate(H/F) anglais courant (H/F),"Crit Aéro, partenaire des recrutements pour Airbus, Pionnier de l'aérospatiale durable pour un monde sûr et solidaire, vous propose un poste de Data Analyst et product Owner.
Valérie, notre Commandante de Bord pour ce recrutement vous explique pourquoi rejoindre Airbus : ""Tout simplement, venez partager votre mindset & vos compétences en travaillant avec des équipes multiculturelles pour contribuer à un avenir plus sûr & plus sain dans les airs »  
Nous nous engageons pour un long voyage, Crit Tertiaire recrute en mission de Travail Temporaire, pour ce poste Le salaire dépendra de votre profil en adéquation avec la grille de la convention de la métallurgie
Pour préparer ce voyage, après la réalisation d'une pré qualification téléphonique, vous serez convié(e) à un entretien avec notre équipe dans le but d'étudier votre parcours, échanger sur vos attentes....
On vous dit tout !! Faisons escale sur votre plan de vol et les attentes du poste :
Comprendre les processus, les rôles, les activités et les objets métier qualité pour mieux servir l'entreprise. 
Intégrer une équipe en phase de constitution car l'entité QXEP Service Qualité est relativement nouvelle.
Préparer des visualisations et des tableaux de bord pour l'examen mensuel des performances des principaux objectifs de l'entreprise et des fonctions aux niveaux du comité exécutif et des fonctions principales (souvent en mode réactif, avec des corrections et des demandes de dernière minute)
Soutenir le développement de l'analyse de données et de la business intelligence liés aux sujets de qualité
Vous avez une première expérience sur le secteur Aéronautique ou de l'Industrie   L'embarquement approche. Le saviez-vous : En 10 ans, le pourcentage de femmes occupant un poste dans l'Aéronautique est passé de 18% à 23% selon le Gifas...Embarquez avec nous et laissez-vous guider !
 Reprenons notre check-list pour en savoir plus sur ce poste et faisons une escale sur vos compétences de base nécessaires à votre réussite sur le poste
Avant l'embarquement, vérifions que nous n'avons rien oublié, dans vos bagages : de l'envie, motivation, rigueur et de l'assiduité ! Votre carte d'embarquement:
 Vous avez au moins 5 ans d'expérience professionnelle, de préférence Expérience en qualité, fabrication et/ou approvisionnement
Au moins 3 ans d'expérience dans le développement de solutions d'analyse et de visualisation.
Expérience démontrée dans la gestion de données et/ou de produits numériques (compréhension et captation des besoins d'affaires, réalisation de projets numériques, business intelligence) dans un environnement international.
Expérience innovante
Excellentes aptitudes de communication
Vous ne correspondez pas à 100% aux critères   Ne vous  inquiétez pas!
Airbus soutient votre croissance personnelle avec des solutions de développement personnalisées.
Aptitudes et compétences souhaitées
Gestion de projet ou de produit : Safe, AGILE, Kanban, Projet ou LBIP+
Amélioration continue : Lean, 8D, Quality mindset, PDCA et Analyses et statistiques
IL: Codage (Langages : Python, VBA, Javascript, SQL)
Concepts et ensembles d'outils de la plate-forme Foundry utilisés pour l'analyse et la visualisation des données (Contour, Code Workbook, Code Repository).
Qlik Sense
Méthodes de développement DevOps
Vous êtes organisé pour respecter les délais.
Curieux, rigoureux, autonome, vous faites preuve de capacités d'analyse et de diagnostic.

Dans l'Aéronautique, on lit le plan de vol jusqu'au bout pour assurer la qualité du voyage de l'avion...
Alors si vous avez bien tout lu, n'oubliez pas le nom de code : ""Embarquement immédiat pour Airbus""
Tous nos postes sont ouverts aux candidats en situation de handicap.",Études et prospectives socio-économiques,"[{'code': '109527', 'libelle': 'Adapter les outils de traitement statistique de données', 'exigence': 'S'}, {'code': '109528', 'libelle': ""Rédiger l'information produite"", 'exigence': 'S'}, {'code': '109529', 'libelle': 'Présenter et diffuser les résultats des études réalisées', 'exigence': 'S'}, {'code': '109542', 'libelle': 'Réaliser une étude', 'exigence': 'S'}, {'code': '300457', 'libelle': ""Définir et faire évoluer des procédés de traitement de l'information"", 'exigence': 'S'}]",0.95619136095047
Designer / Designeuse produit (H/F),"Barrière, c'est 33 Casinos, 1 Club de Jeux, 19 Hôtels, plus de 120 Restaurants et Bars, 15 Spas, 3 Golfs, 2 Tennis Club, 1 Balnéo, 1 Thalasso. Barrière, c'est aussi 50 métiers incarnés par près de 7000 collaborateurs, en France et à l'international. Et par vous aussi demain  

    Contexte & Lieu de travail, pour briller en entretien

Afin de repenser l'expérience client et collaborateur pour l'ensemble de nos métiers Casinos, Jeux en ligne, Hôtel et Restauration, nous recherchons le/la futur(e) Head of Product Design.

Au sein de la division Digitale, Data et Technologie du groupe Barrière, le département Produit garantit la pertinence et la cohérence des parcours et produits digitaux mis à disposition des clients et collaborateurs. Rattaché(e) à la CPO, vous serez en charge de la conception et de l'amélioration continue des différents sites, applications mobile et  interfaces utilisateurs

    Vos missions si vous l'acceptez

Comprendre et analyser les problématiques et attentes des utilisateurs : concevoir, réaliser et restituer des interviews utilisateurs, des discovery, des design sprint, animer des ateliers de co-conception, d'idéation, et modéliser l'expérience client sous forme d'empathy maps, customer journeys...
Proposer et mettre en place des processus et des méthodes de conception, en coordonnant les métiers, les utilisateurs et les équipes produit afin d'améliorer nos standards Design ;
Analyser la concurrence et les bonnes pratiques ;
Concevoir les nouvelles expériences clients, les parcours, les maquettes, prototypes en ligne avec les standards d'accessibilité & SEO et qui répondent aux enjeux business ;
Réaliser des tests utilisateurs afin de valider les propositions de maquettes et parcours ;
Améliorer et maintenir une cohérence des expériences clients existantes ;
Superviser l'enrichissement du design system existant et la construction du nouveau pour l'hôtellerie ;
Encadrement de 2 UX/UI externes et pilotage d'une agence en cas de besoin.
  
   Votre bon Profil

Vous justifiez d'une expérience confirmée de 5 ans en tant que Product Designer sur des sujets B2C, APP, Web et/ou e-commerce ;
Maîtriser la conception UX/UI, le maquettage ;
Très bon relationnel et bon communicant ;
Maîtrise des pratiques Agile ;
Solides compétences en analyse de données et mesure permanente de l'impact ;
Capacité à structurer une discovery, mener des interviews utilisateurs, analyser des insights et valider ou invalider des besoins ;
Vous faites preuve d'empathie, d'une grande autonomie et de rigueur ;
Excellentes compétences en communication et en gestion des parties prenantes ;
Vous savez prendre des initiatives et mettre en avant vos idées pour améliorer les pratiques collectives ;
Vous maîtrisez les outils de production d'UX Design : Figma, Figjam, Miro, Mural, Maze, Notion, Jira, Confluence, etc.

  Nos pétillances

Des bureaux modernes, connectés, avec une salle de sport ;
Le 13ème mois ;
Une Charte télétravail autorisant jusqu'à 3 jours par semaine ;
L'opportunité de suivre des formations (métiers, produits, d'empowerment...) ;
Un accompagnement personnalisé pour développer votre potentiel et évoluer au sein de notre Groupe ;
Des tarifs collaborateurs pour se faire des week-ends de rêve.

Faire vivre des moments exceptionnels à nos clients, voilà votre future raison d'être.
Barrière, 50 métiers, 1 seul état d'esprit. N'hésitez plus, rejoignez-nous !",Design industriel,,0.9548998475074768
Ingénieur système solutions mécatroniques véhicule électrique (H/F),"Lieu de travail : Montréal, QC, Canada
 *contrat de droit local*

1 poste à pourvoir
- 37,5h/semaine du lundi au vendredi (possibilité de temps complémentaire jusqu'à 40h /semaine)
- Présence sur site : 100 % (possibilité d'une formule hybride 3/5)

Classification nationale des professions (CNP)
21231 - Ingénieurs/ingénieures et concepteurs/conceptrices en logiciel
21311 - Ingénieurs informaticiens/ingénieures informaticiennes (sauf ingénieurs/ingénieures et concepteurs/conceptrices en logiciel)
21310 - Ingénieurs électriciens et électroniciens/ingénieures électriciennes et électroniciennes

En tant que membre du service ingénierie R&D relevant du chef de service, vous collaborez étroitement avec des équipes d'ingénierie multidisciplinaires pour la définition, le suivi et la validation des exigences fonctionnelles des solutions R&D, notamment celui de systèmes de batteries.

- Collaborer avec diverses équipes interfonctionnelles afin d'établir des exigences pour les nouvelles fonctionnalités du système de batterie, les diagnostics, les algorithmes, etc.
- Élaborer des exigences et des documents de spécifications au niveau du système et du sous-système en collaboration avec les équipes de conception optique, électrique et mécanique
- Diriger les activités de vérification de la conception, rédiger des propositions et des livres blancs, fournir une assistance technique aux activités de développement commercial, dont des présentations aux clients et de conférence, diriger l'évaluation de la préparation technique et de l'analyse des risques
- Collaborer étroitement avec des équipes d'ingénierie du matériel et de la mécanique pour le suivi et la gestion des besoins de développement des batteries
- Collaborer étroitement avec des équipes V&V pour la réalisation du processus de test et de validation
- Réaliser le développement de fonctionnalités et caractéristiques fonctionnelles spécifiques à la sécurité
- Communiquer avec les ingénieurs pour mettre à jour/modifier la documentation afin de maintenir une représentation précise des livrables
- Contribuer à l'architecture globale de système
- Soutenir le développement des processus de production en série et de standardisation des processus entre les différents services
- Réaliser des tâches ou des projets ad hoc fournis par la direction
- Collaborer avec des équipes pluridisciplinaires pour s'assurer que les sous-systèmes pertinents sont conçus selon les exigences appropriées. Travailler en étroite collaboration avec les ingénieurs de conception, de qualité et de fabrication des produits, ainsi qu'avec l'équipe de production afin d'assurer que le système réponde à tous les objectifs critiques du client
- Évaluer, concevoir et intégrer des systèmes logiciels de batteries aux véhicules et aux systèmes connexes afin d'équilibrer les exigences de performance, de fiabilité, de coût et de poids

Requis
Expérience avec des outils de simulation au niveau du système (MATLAB Expérience) avec des outils de gestion des exigences (DOORS)
- Travailler dans un environnement multidisciplinaire
- Bac+3/4 ou 5 en génie ou dans un domaine similaire - 8 ans d'expérience minimum
- Expérience avec Model Based Systems Engineering et SysML.
- Expérience avec IBM DOORS/ELM ou autre outil de gestion des exigences.
- Connaissance développement Agile de systèmes intégrés (mécaniques, électriques et logiciels).
- Avoir de fortes compétences en communication, une façon de travailler proactive et orientée vers les solutions et la volonté de vous familiariser avec les nouvelles technologies et les outils de développement.
- Anglais courant
- connaissance des normes automobiles telles que ISO 26262, IATF 16494, AEC-Q100, APQP, PPAP; Connaissance des protocoles de communication sans fil et câblés est un atout.

Salaire compétitif selon expérience, 4 sem. congés payés,11 jours Fériés, 5 Maladie, Programmes assurances collectives d'entreprise, Participation REER de l'employeur, Bonus","Management et ingénierie études, recherche et développement industriel","[{'code': '118500', 'libelle': 'Élaborer des propositions techniques', 'exigence': 'S'}, {'code': '119161', 'libelle': ""Identifier les contraintes d'un projet"", 'exigence': 'S'}, {'code': '124529', 'libelle': ""Déterminer des axes d'évolution technologiques"", 'exigence': 'S'}, {'code': '300488', 'libelle': 'Concevoir et gérer un projet', 'exigence': 'S'}]",0.9538056254386902
