intitule,description,romeLibelle,competences,cosine_similarity
Airbus atlantic - ingénieur supply chain & logistique (all gender) (H/F),"Description de l'emploi :Vous êtes à la recherche d'un nouveau challenge ??ContexteUn poste d'Ingénieur Supply Chain & Logistique vient de s'ouvrir au sein d'Airbus Atlantic sur son site de Méaulte (80). Dans le cadre de montées cadence et de transformations industrielles, vous rejoindrez le Service Cross Plant PC&L afin de supporter les sites opérationnels tout en assurant une vision et dynamique métier pour le groupe Airbus Atlantic.Au sein de l'équipe, vous serez en charge de définir, contribuer et mener des projets pour l'ensemble des sites avec la contribution des opérationnels PC&L et des autres métiers du groupe Airbus Atlantic.Poste proposéLe spécialiste Supply Chain & Logistique a pour principale mission d'animer des équipes opérationnelles multi fonctionnelles et de les fédérer autour d'un objectif commun et d'une vision métier PC&L partagée.A ce titre, ses principales missions sont : Définir, développer et mettre en place les routines qui permettent de répondre aux objectifs de la société en termes de couts, qualité et délaisAccompagner par son expertise l'utilisation des outils et systèmes d'information applicables au métier PC&L planning (SAP, AirSupply, Data viz, ?)Contribuer à l'harmonisation des processus, standards et méthodologies de fonctionnement du métier PC&L planning (en lien avec la démarche AAOS du groupe)Définir, faire valider et maintenir à jour la Roadmap de la communauté PC&L planning, en allant chercher l'adhérence de toutes les parties prenantesPiloter et contribuer aux projets PC&L du PC&L planning (Product Structure, planification, ordonnancement, gestion de master data, flux inter compagnies?)Analyser les écarts constatés lors des routines de surveillance des master data clés du métier PC&L planning pour en assurer la correction avec les opérationnels PC&L site concernés ainsi que les autres métiers impactésIdentifier, faire connaitre et transversaliser les Best Practices au sein de la communauté métier PC&L planningCréer, maintenir, ou fournir des supports documentaires permettant de formaliser et harmoniser les Best Practices du métier planningGérer les activités de sous-traitance lorsqu'applicable (spécifications, suivi des livrables ?).Parlons de vous !Nous recherchons des candidats ayant les expériences et les compétences suivantes :De formation Bac+5 Mécanique/Génie industriel ou équivalent avec une expérience de 3 ans minimum en Supply Chain et/ou Gestion IndustrielleMaitrise et pratique opérationnelle des principes MRP II (notamment PDP-MRP-Exécution) et des concepts de la Supply Chain globale au sein d'une entité de productionBonne connaissance des outils, méthodes et solutions de gestion de Projet (LBIP, démarche d'amélioration, ?)Expérience confirmée dans l'analyse de données (via divers outils de data visualisation) et de l'environnement SAPBon fonctionnement en réseau multi-métiers et multisites avec une certaine aisance de communicationAutonome, rigoureux et pédagogueBon niveau d'anglais recommandé (B1)La certification APICS (CPIM niveau 1) serait un plus appréciéParlons de nous !Notre site Airbus Atlantic de Méaulte (80) est spécialisé dans l'assemblage de toutes les pointes avant Airbus mais il est également un centre de Recherche et Technologies et un lycée d'enseignement d'excellence.Environnement & Conditions de travail :Airbus Atlantic c'est aussi : Prendre part à des projets ambitieux, à la pointe de la technologie pour construire l'avion de demain, en lien avec les enjeux environnementaux.  Un environnement qui valorise la proximité et la dimension humaine, au sein d'un collectif engagé et solidaire.L'opportunité d'apprendre et d'évoluer tout au long de votre parcours, en étant accompagné dans votre développement pour une carrière sur-mesure. Avoir la liberté d'entreprendre et de laisser libre court à vos initiatives.Ses conditions de travail attractives et ses avantages : restaurant d'entreprise s",Management et ingénierie gestion industrielle et logistique,,0.953413188457489
Ingénieur Production Monitoring et Analytics (débutant) - F/H (H/F),"Une grande quantité d'équipements de production des sites opérés par Total Energies sont connectés grâce au logiciel PI qui collecte les mesures effectuées par les instruments et les amène en temps réel sur nos écrans. Ces données sont d'abord essentielles pour les équipes en charge du support des installations. Ensuite, le PI Monitoring Center (PIMC) est chargé de valoriser cette donnée en fournissant à nos clients sur les sites industriels des solutions avancées de surveillance pour améliorer la performance des opérations.

 
Une des applications fournies par le PMIC a pour objectif de surveiller les émissions de gaz à effet de serre et l'efficacité énergétique sur l'ensemble de nos installations en temps réel. Dans ce cadre, vous serez intégré.e à l'équipe afin de :

 * Créer des modèles (PI-AF, PI-Vision, Power BI.) pour le suivi/amélioration de l'efficacité énergétique des consommateurs significatifs d'énergie tels que les pompes, les compresseurs et les turbines.
 * Créer des modèles de suivi des émissions et d'optimisation des gaz à effet de serre dans les actifs opérés.
 * Incorporer d'autres bases de données (hors temps réel) dans nos modèles pour contribuer à la détection de gaz à effet de serre.

 
Vos activités seront marquées par l'abstraction intellectuelle, la modélisation des systèmes et l'algorithmique. Vous fournirez des solutions fonctionnelles en adoptant une approche agile centrée sur la satisfaction du client. Enfin, la maîtrise de la suite PI vous permettra de créer et de proposer des solutions de surveillance avancées, capitalisant sur l'expertise et le savoir-faire de notre branche OneTech.
Nous recherchons au CSTJF à PAU (64), un.e Ingénieur Production Monitoring et Analytics (débutant) - F/H

Vous êtes récemment diplômé.ée d'un Bac+5 en tant qu'ingénieur.e généraliste ? Débutez votre carrière au sein d'une entreprise engagée aux multiples facettes et venez apprendre auprès d'équipes internationales expérimentées !

Vous avez des connaissances générales sur les installations de traitement d'huile et de gaz (thermodynamique, mécanique des fluides, électronique) ainsi que sur les processus industriels (types de machines, capteurs...) ? 

Vous maitrisez Power BI et les requêtes vers différentes sources (Web, SQL, Excel, API Web) ? Des connaissances sur la Suite PI est un vrai plus ! 

Doté.e d'un sens de l'écoute, vous êtes orienté.e client ? 

Vous êtes reconnu.e pour votre esprit d'équipe, votre curiosité et vos capacités de communication ? 

Un niveau d'anglais intermédiaire/avancé est requis pour ce poste. 

Dans le cadre de sa politique Diversité, TotalEnergies étudie, à compétences égales, toutes candidatures dont celles de personnes en situation de handicap. 

 

Nous vous proposons un Contrat de Professionnalisation Temps Plein qualifiant de 12 mois (100% en entreprise) incluant 15% de formation interne (métier, linguistique, outils.) dispensée par des organismes sélectionnés par TotalEnergies. Ce contrat vous permettra d'acquérir une année d'expérience professionnelle tout en étant formé aux spécificités de votre métier en lien avec les activités de la Compagnie. Un réel atout pour booster votre employabilité !Pour postuler à cette offre, vous devez impérativement posséder, à la date d'embauche, un titre de séjour valide pour la période couverte par cette offre (minimum 13 mois). Attention, la conclusion de ce contrat de professionnalisation ne permet pas la délivrance d'un titre de séjour (article R.52221-6 du Code du travail).

Ce poste ne s'adresse pas aux personnes recherchant une alternance avec une école ou une formation diplômante, mais aux personnes récemment diplômées à la recherche d'une première expérience.","Management et ingénierie études, recherche et développement industriel",,0.953108012676239
Développeur / Développeuse décisionnel - Business Intelligence,"Au sein de notre siège social, nous recherchons notre prochain(e) Développeur BI F/H/X.

Encadré(e) par un Chef de Projet, vous aurez la charge d'appréhender les problématiques Data des directions métiers, de les accompagner dans la structuration de leurs besoins et de mettre en place les solutions data et reporting au sein de notre marque.

En tant que référent(e) technique de l'environnement BI, vos principales missions seront :

Analyser les besoins métiers :

- Collecter et analyser les besoins métiers

- Être force de proposition pour déployer de nouveaux rapports/dashboards pertinents pour les équipes métiers

Conception :

- Participer à la constitution du schéma cible de data

- Définir l'architecture data

- Définir les indicateurs et dictionnaires de données

- Rédiger les spécifications techniques

- Cartographier les flux de données

- Définir les interfaces de données à partir des diverses sources de données d'entreprise et les transformations requises (ETL Talend)

Développement des solutions BI :

- Développer des flux de données entre les datasources et le framework (ODS / datawarehouse / datamart) dans un contexte multi-sources (ETL Talend)

- Développer des reports et dashboards sous Microsoft PowerBI (static et dataviz)

Recettes / Qualité :

- Réaliser les tests d'intégration et transformation des données

- Contrôler l'intégrité des données par rapport aux besoins

Assurer le Support utilisateurs :

- Réception et résolution des dysfonctionnements rencontrés par les utilisateurs

- Assurer le relais avec des prestataires de services sur la TMA de certaines briques applicatives (TM1, Cognos)

- Gestion des demandes d'évolutions en fonction de leur impact business et veiller à ce qu'un suivi soit fait sur chaque incident

Maintenance et évolution des flux de données : 

- Suivre et améliorer les process d'alimentation mis en place

- Consommer des données de webservices / Api

- Proposer des solutions d'optimisation des modèles existants

- Assurer la maintenance des documentations dans le cadre d'améliorations ou d'évolutions techniques

Assurer le RUN :

- Surveillance et gestion des traitements planifiés (chaines de traitements BI)

- Être garant de la qualité et de la cohérence des données du Datawarehouse

- Participer au maintien à jour des plateformes / applicatifs (paramétrage, suivi, identification d'améliorations,  )

- Proposer des solutions d'optimisation des modèles existants

- Devenir le référent technique de l'environnement Data pour les équipes techniques internes


Si vous vous reconnaissez dans ce portrait et que :

Vous avez des connaissances ETL Talend, BDD Microsoft SQL Server, Microsoft Power BI

 Vous êtes passionné(e) par la Data, organisé(e), curieux(se), autonome ? Vous avez un bon sens du relationnel et un esprit d'analyse et de synthèse  ?

Alors nous nous sommes trouvés !

De notre côté, nous nous engageons à vous offrir un cadre de travail enthousiasmant, riche en projets au sein d'une équipe dotée d'une double dose d'optimisme ! Nous permettons à nos collaborateurs de télétravailler 2j/semaine.

Reconnue entreprise à mission depuis 2020, Aigle étend son engagement social en faveur d'un monde du travail accessible aux personnes en situation de handicap, visible ou invisible.

 Nos offres d'emploi sont par conséquent ouvertes à tous.",Études et développement informatique,"[{'code': '300688', 'libelle': 'Application web', 'exigence': 'S'}, {'code': '109846', 'libelle': 'Concevoir une application web', 'exigence': 'S'}, {'code': '300188', 'libelle': 'Rédiger un cahier des charges, des spécifications techniques', 'exigence': 'S'}, {'code': '300242', 'libelle': 'Déterminer des mesures correctives', 'exigence': 'E'}, {'code': '300366', 'libelle': 'Recueillir et analyser les besoins client', 'exigence': 'E'}]",0.9529454112052917
Data Scientist Junior (H/F),"Dans le cadre d'un projet ambitieux dans la lutte contre la fraude dans le domaine du e-commerce, nous recherchons activement un profil qui correspondra aux attentes suivante:

Responsabilités :
Collaborer avec les équipes pour comprendre les besoins métier et identifier les opportunités d'application de l'analyse de données.
Concevoir, développer et mettre en œuvre des pipelines de données pour l'extraction, le nettoyage, la transformation et la visualisation des données.
Effectuer des analyses exploratoires pour identifier des tendances, des modèles et des insights significatifs.
Développer et mettre en œuvre des modèles de machine learning et des algorithmes de prédiction.
Participer à la conception et à l'implémentation d'architectures de bases de données.
Intégrer les modèles et les analyses dans des applications et des systèmes en production.
Maintenir une documentation précise des processus, des modèles et des analyses réalisées.


Diplôme en ingénierie (Bac +5 ou plus) dans le domaine de l'IT (Computer Science).

Maîtrise de Python, SQL, Neo4j et des bibliothèques couramment utilisées pour l'analyse de données.
Expérience pratique avec des outils de développement et de déploiement de modèles ML/DL sur Dataiku.
Compréhension des concepts de data engineering et des pipelines de données.
Capacité à travailler dans un environnement dynamique et à s'adapter rapidement aux nouvelles technologies et aux nouveaux défis.
Excellentes compétences en communication et en travail d'équipe.

Atouts :
Expérience avec des bases de données NoSQL et Graphs.
Connaissance des outils de conteneurisation et d'orchestration.
Expérience dans la conception de systèmes de recommandation.
Compréhension des principes de l'apprentissage automatique en ligne.
Maîtrise d'autres langues, en particulier le français et l'anglais.

À propos de vous :
Vous êtes un ingénieur passionné par l'analyse de données et l'apprentissage automatique, doté d'un esprit curieux et d'une capacité à résoudre des problèmes complexes. Vous aimez travailler dans un environnement collaboratif où l'innovation est encouragée, et vous êtes prêt à contribuer activement à des projets de données stratégiques qui ont un impact significatif sur l'entreprise.


Date de début : Immédiatement
Télétravail possible
Maîtrise du français et de l'anglais indispensable
Déplacement surtout sur Paris et Lille",Études et prospectives socio-économiques,"[{'code': '101397', 'libelle': 'Modélisation et simulation', 'exigence': 'S'}, {'code': '102732', 'libelle': 'Langages de programmation informatique', 'exigence': 'S'}, {'code': '113255', 'libelle': 'Business Intelligence (BI) / Informatique décisionnelle', 'exigence': 'S'}, {'code': '115921', 'libelle': 'Big data Analytics', 'exigence': 'S'}, {'code': '117685', 'libelle': 'Modélisation statistique', 'exigence': 'S'}, {'code': '109527', 'libelle': 'Adapter les outils de traitement statistique de données', 'exigence': 'E'}, {'code': '109528', 'libelle': ""Rédiger l'information produite"", 'exigence': 'E'}, {'code': '109529', 'libelle': 'Présenter et diffuser les résultats des études réalisées', 'exigence': 'E'}, {'code': '117323', 'libelle': ""Coordonner le déroulement d'une étude"", 'exigence': 'S'}, {'code': '117698', 'libelle': 'Concevoir des modèles de détection des insights consommateurs', 'exigence': 'S'}, {'code': '120552', 'libelle': 'Analyser les insights et les usages des consommateurs', 'exigence': 'S'}, {'code': '122178', 'libelle': 'Réaliser des études spécifiques', 'exigence': 'S'}, {'code': '124418', 'libelle': 'Réaliser un modèle de prévision', 'exigence': 'S'}, {'code': '125901', 'libelle': ""Mettre en place des outils d'aide à la décision"", 'exigence': 'S'}, {'code': '300119', 'libelle': 'Réaliser une veille documentaire', 'exigence': 'E'}, {'code': '300457', 'libelle': ""Définir et faire évoluer des procédés de traitement de l'information"", 'exigence': 'E'}, {'libelle': 'Data science methodology', 'exigence': 'S'}, {'libelle': 'Deep Learning', 'exigence': 'E'}, {'libelle': 'Fraud detection', 'exigence': 'S'}, {'libelle': 'Machine Learning', 'exigence': 'E'}]",0.9526473879814148
Technical leader data scientist f/h (H/F),"Safran est un groupe international de haute technologie opérant dans les domaines de l'aéronautique (propulsion, équipements et intérieurs), de l'espace et de la défense. Sa mission : contribuer durablement à un monde plus sûr, où le transport aérien devient toujours plus respectueux de l'environnement, plus confortable et plus accessible. Implanté sur tous les continents, le Groupe emploie 83 000 collaborateurs pour un chiffre d'affaires de 19,0 milliards d'euros en 2022, et occupe, seul ou en partenariat, des positions de premier plan mondial ou européen sur ses marchés. Safran s'engage dans des programmes de recherche et développement qui préservent les priorités environnementales de sa feuille de route d'innovation technologique.



Safran est dans le top 30 des meilleurs employeurs mondiaux 2022 selon le magazine Forbes.



Safran Engineering Services offre des services en ingénierie de haute technologie dans les domaines de l'aéronautique, de l'énergie et du transport terrestre. Avec 30 ans d'expérience, la société s'appuie sur 3 000 ingénieurs répartis dans 9 pays à travers le monde.


Descriptif missionLa data science est au coeur de la transformation industrielle chez Safran et se met au service de nos métiers de la production (manufacturing 4.0) ou de la surveillance de nos systèmes en vol (Service 4.0).

En intégrant Safran Engineering Services vous aurez l'opportunité de pouvoir répondre aux problématiques industrielles actuelles en utilisant les données métier issues des machines de production, des capteurs embarqués, des opérations de maintenance, etc et mettant en oeuvre les technologies algorithmiques de l'état de l'art.

Dans ce cadre et au sein du pôle Data de Safran Engineering Services, votre mission consistera à intervenir sur toutes les phases du cycle de vie d'un projet data (Prise de besoin métier, Proof of Concept, industrialisation). Vous aurez la responsabilité d'encadrer techniquement les jeunes data scientist de l'équipe sur leur projet, d'assurer leur montée en compétences et de supporter le management sur la structuration de l'équipe dans sa croissance. 



Concrètement, vous aurez trois principaux volets de responsabilité : 



o Production technique



- Définir le besoin en échangeant avec les métiers

- Appliquer des techniques d'extraction et d'analyse d'informations, obtenues à partir de différentes sources de données industrielles, 

- Evaluer la qualité et la richesse des données, les analyser et en restituer les résultats vers le Métier, 

- Analyser les données pour traduire une problématique Métier en problème mathématique/statistique et réciproquement,

- Comparer et évaluer différents modèles ou méthodes de calculs (Machine Learning, deep learning) et anticiper les avantages et inconvénients dans un environnement Métier,

- Concevoir et développer des visualisations impactantes pour le métier

- Utiliser les infrastructures Cloud de Safran (AWS)

- Spécifier les solutions retenues et accompagner l'équipe dans l'industrialisation des traitements de données dans un logiciel industriel.



o Support au cadrage des projets



- Contribuer à l'élaboration des réponses techniques aux appels d'offres 

- Identifier les work packages des projets en phase de démarrage



o Mentoring technique des profils juniors



- Participer à l'évolution et l'amélioration continue de l'équipe Data (nouvelles offres, méthodes, pratiques de code, ...)

- Assurer la montée en compétences des data scientist (veille technique et scientifique, animation de l'équipe)",Installation et maintenance d'équipements industriels et d'exploitation,,0.9521639943122864
Chef de Projet Dynamics CRM F/H - mylight150 (H/F),"En tant que chef de projet Dynamics CRM, tu seras en charge de la plateforme Dynamics 365 et des outils liés au domaine Commerce, Support & Marketing. 
Rattaché(e) au manager du pôle ERP & Business Solutions, au sein d'une direction informatique en plein développement, tes principales missions seront : 
 
 
  
- Analyser, comprendre et rédiger les besoins des utilisateurs métiers et proposer des solutions adaptées et innovantes autour de la solution CRM pour optimiser les processus métier et réduire les coûts (Sales, Customer Service & Marketing), 
- Configurer l'application MS Dynamics CRM 365 en fonction des besoins spécifiques de l'entreprise (Formulaire, modèle de données, paramétrage.), 
- Travailler en collaboration avec les départements métiers, du pôle Produit & Innovation, en utilisant les méthodologies internes de gestion de projet et déploiement (Agile, Azure DevOps.), 
- Piloter le déploiement des solutions et garantir la disponibilité et l'intégrité des données entrantes et sortantes en collaboration avec nos partenaires internes / externes, 
- Assurer le maintien en condition opérationnelle de la plateforme CRM et de son intégration au sein du SI global, 
- Participer à l'assistance du CRM auprès des utilisateurs, 
- Assurer la veille technologique et le suivi des évolutions de la plateforme 365 et anticiper les impacts et opportunités la concernant. 
 
- Issu(e) d'une formation supérieure (IT idéalement), tu as acquis au moins 3 ans d'expérience au sein d'une ESN ou d'une DSI dont une expérience d'au moins 2 ans traitant des sujets d'implémentation / développement de la solution Microsoft Dynamics CRM 365 (SaaS) dont tu as une excellente connaissance des différents modules. Idéalement tu as l'habitude de traiter des sujets autour de la Power Platform (Automate et Apps), ainsi qu'une connaissance des technologies Javascript/.NET.   
- Tu as une forte sensibilité sur la qualité des données et l'efficience opérationnelle de tes clients internes et adore travailler au contact des métiers.   
- Curieux(se), tu es guidé(e) par ton envie d'apprendre et de partager tes connaissances. Ta capacité d'organisation et de rédaction te permet d'élaborer des cahiers des charges, plan de test, ou encore documentation technique ou utilisateur.  
- Tu es reconnu(e) pour ta flexibilité, ta ténacité et ton savoir-être.  
- Tu parles couramment anglais. 
 
 
 
Compétences SI attendues :
 
 
  
- CRM : Expérience significative sur Dynamics CRM 365 (Sales, Field Service.) 
- Plateforme Microsoft : Power Apps, Power Automate, Dataverse 
- SQL / BI : Connaissances pratiques 
- ERP : Idéalement MS Dynamics Business Central ou MS Navision 
- Méthodologie & Outil Projet : Scrum, Azure DevOps",Ingénierie et études du BTP,,0.9520105719566345
