intitule,description,romeLibelle,competences,cosine_similarity
Data Scientist H/F (H/F),"Vos missions
Acteur/Actrice du changement, vous jouerez un rôle clé dans l'analyse et l'exploitation de nos données pour mettre en place et développer des méthodes analytiques et contribuer à l'amélioration continue de nos produits/services. Vous travaillerez en étroite collaboration avec notre équipe de data scientist, d'ingénieurs et d'autres départements pour résoudre des problèmes complexes et vulgariser les résultats.

Votre quotidien
En tant que Data Scientist, vous :

Collectez, nettoyez et préparez les données pour l'analyse.
Concevez, développez et mettez en œuvre des modèles de machine learning et d'apprentissage profond.
Effectuez des analyses statistiques pour extraire des informations significatives.
Collaborez avec les équipes métier pour comprendre leurs besoins et proposez des solutions basées sur les données.
Créez des tableaux de bord et des rapports pour visualiser les résultats de l'analyse powerBI ou autre.
Participez à la recherche de nouvelles sources de données pertinentes.
Restez à jour avec les dernières avancées en matière de data science et de machine learning.


Contexte
Au sein de la Direction Générale Industrielle & Ingénierie, vous travaillerez dans une jeune équipe de Data Science du département Intégration Projets Multi-métiers et Mesures (IP3M). Vous répondrez au besoin exprimé par la Direction Technique.

Horaires
Poste au forfait jour.

Profil recherché
Titulaire d'un BAC+5 en statistiques, mathématiques, informatique ou domaine connexe (master ou école d'ingénieurs), vous disposez d'une expérience démontrée en data science, y compris la création de modèles prédictifs.

Vous maîtrisez des langages de programmation tels que Python ou/et R et avez une connaissance des bibliothèques et des frameworks de machine learning (scikit-learn, TensorFlow, ...) ainsi que des compétences en manipulation de données et en outils tels que SQL, Pandas, etc.

Vous maitrisez Devops et git et avez d'excellentes compétences en communication et en présentation.

Une capacité à travailler de manière autonome et en équipe est demandée.

La connaissance du ferroviaire serait un plus.",Études et prospectives socio-économiques,"[{'code': '109527', 'libelle': 'Adapter les outils de traitement statistique de données', 'exigence': 'S'}, {'code': '109528', 'libelle': ""Rédiger l'information produite"", 'exigence': 'S'}, {'code': '109529', 'libelle': 'Présenter et diffuser les résultats des études réalisées', 'exigence': 'S'}, {'code': '300119', 'libelle': 'Réaliser une veille documentaire', 'exigence': 'S'}, {'code': '300457', 'libelle': ""Définir et faire évoluer des procédés de traitement de l'information"", 'exigence': 'S'}]",0.9631723761558533
Data analyst (H/F),"Description du poste :
Au sein du pôle Marketing Conquête, vous aurez pour mission de suivre l'activité de recrutement de nouveaux clients au travers des actions marketing et commerciales en exploitant les différentes sources de données.
Vous utiliserez des outils et des techniques statistiques afin d'organiser, de synthétiser et de traduire les informations pour faciliter la prise de décision. Vous valoriserez l'ensemble des données client pour en extraire de la connaissance utile à l'optimisation des offres et services de Boursorama.
Vous aurez comme principales missions :
Reporting et suivi des actions commerciales :***Concevoir, produire et automatiser la production des tableaux de bord de l'activité commerciale et marketing
* Produire des insights pertinents pour tirer des enseignements, lever des alertes dans le cadre de certains reportings d'activités à forte valeur ajoutée, notamment au regard des actualités business
* Mettre en place des solutions de DataVisualisation et s'assurer de leur évolution
* Réaliser certains ciblages d'opérations commerciales / campagnes marketing : appropriation du contexte et des enjeux, challenge des demandeurs métier
* Produire des bilans d'opérations commerciales / campagnes marketing en identifiant des enseignements sur la performance des campagnes et des recommandations pour des futures actions marketing
Analyses et modélisation :***Réaliser des études statistiques adhoc sur des problématiques marketing (acquisition, lancement de produits/services .)
* Etudier la performance du recrutement de nouveaux clients : profils clients recrutés, types de produits souscrits, performance des leviers d'acquisition
* Identifier des solutions utilisant la datascience pour répondre à des enjeux du pôle Marketing Conquête (prévision du volume d'entrées en relation, optimisation du CAC.) et créer, suivre et faire évoluer les modélisations correspondantes en utilisant les données et les méthodes statistiques les plus pertinentes (linéaires et non linéaires) en lien avec les data scientists de la direction Marketing et Communication
* Préconiser de nouvelles méthodes et sources de données pour améliorer les modèles existants (R&D et approche « Test and Learn »)
Description du profil :
De formation Bac+4/5 en Statistiques ou Data Analyse, vous possédez une expérience réussie dans ce domaine d'environ 3 ans un poste similaire en agence média, régie publicitaire ou chez l'annonceur.
Vous avez une bonne compréhension des problématiques marketing.
Vous maitrisez impérativement SAS, SQL ainsi que les outils de MS Office (Excel, Power Point) et les fondamentaux du Machine Learning
Vous avez une connaissance des langages informations (Python, Scala) et des outils de DataVisualisation.
Vous êtes rigoureux, fiable, autonome et impliqué. Votre bon sens du relationnel et votre enthousiasme ne sont plus à démontrer.
N'hésitez plus et postulez à notre offre. Si votre candidature est sélectionnée, vous serez invité à réaliser une vidéo de présentation. Nous vous contacterons ensuite pour un entretien.",Études et prospectives socio-économiques,,0.962507963180542
Data Analyst expérimenté Business (H/F),"Si tu es animé(e) par la passion de transformer les chiffres en récits concrets et porteurs de sens, à l'instar de l'esprit novateur d'Archimède, et que tu as le sens de l'écoute des besoins métier du client, tu pourrais être le Data Analyst (H/F) expérimenté(e) business que nous recherchons. Rejoins notre équipe pour apporter ton expertise et ton talent d'analyse, et deviens le/la visionnaire des données qui révèlera de nouvelles perspectives métier. En tant que professionnel(le) expérimenté(e), tu connais divers aspects du traitement de la donnée dans les entreprises, qu'il s'agisse des flux, de la BI, de l'analytique métier, de la gestion, de la logistique, du commerce, du SAV, et bien plus encore.

Equipe:
Le pôle Data est constitué de 7 spécialistes qui travaillent en étroite collaboration avec les différents pôles de l'agence. En tant que membre de ce pôle, tu seras en contact direct avec les membres du pôle Data, les chefs de projet, les architectes techniques et les responsables hiérarchiques de l'agence.

Scope, Sujets :
Données métier, données d'entreprise, approche data driven, business intelligence, analyse statistique, collecte, exploration, consolidation, transformation de données, data visualisation, storytelling.

Types de projets:
Analyse de performances marketing, optimisation de la chaîne d'approvisionnement et l'identification d'opportunités de croissance, analyse de données ouvertes, scraping, analyse statistique au cas par cas.

Stack technique:
Python, Pandas, NumPy, Matplotlib, Seaborn, Power BI, SQL (MySQL, PostgreSQL), Scikit-Learn, StatsModels, NLTK, SpaCy, Tableau, Looker, JIRA, Trello, Git, GitHub, Asana.

Candidat.e
Passionné(e) par l'analyse de données, tu es un(e) expert(e) qui comprend parfaitement les besoins métier des entreprises et écoute attentivement les clients. Tu excelles également dans la dataviz, le storytelling et la transformation de données en insights stratégiques pour innover.

Tes missions:
Dans une agence de 100 personnes, au sein d'une équipe de 7 personnes, et sous la responsabilité de notre CTO et du directeur de pôle, tu auras pour mission de :

- Analyser et visualisation des données
- Analyser les données pour identifier les tendances pertinentes
- Traduire les besoins métier en questions analytiques
- Créer des tableaux de bord interactifs et visuels
Optimisation et amélioration:
- Évaluer les performances actuelles et proposer des améliorations
- Mettre en place des modèles prédictifs pour anticiper les tendances
- Fournir des recommandations stratégiques basées sur les analyses
- Suivre l'impact des décisions et ajuster les stratégies
Communication et présentation:
- Présenter clairement les résultats et les insights aux équipes
Veille technologique: 
- Rester à jour avec les dernières tendances en analyse de données


Ton profil:
Exigence
Nous attendons de toi une grande expertise dans l'analyse de données et la capacité à résoudre des problèmes complexes. Tu devras être capable de traduire les besoins métier en questions analytiques pertinentes et de fournir des réponses exploitables.

Passion:
Tu te caractérises par une passion ardente pour l'exploration des données, une curiosité insatiable et un désir constant d'apprendre. Tu devras être orienté(e) vers les résultats, méthodique dans ton approche, et avoir une forte capacité à communiquer efficacement les résultats de ton analyse.

Ouverture:
Comme nous, tu regardes le monde entier avec intérêt : tu aimes rencontrer des gens d'origines diverses, tu parles ou apprends plusieurs langues, les autres cultures sont des sources d'inspiration, tu peux ou souhaiterais voyager. Tu es ouvert(e) aux richesses de l'autre.


Formation:
Bac+5, M2 ou équivalent

 Nous avons tous des imperfections ou un handicap et c'est aussi une force : tu peux nous partager le tien.",Études et prospectives socio-économiques,"[{'code': '109528', 'libelle': ""Rédiger l'information produite"", 'exigence': 'E'}, {'code': '109529', 'libelle': 'Présenter et diffuser les résultats des études réalisées', 'exigence': 'E'}, {'code': '109542', 'libelle': 'Réaliser une étude', 'exigence': 'E'}, {'libelle': 'Git', 'exigence': 'S'}, {'libelle': 'Jira', 'exigence': 'S'}, {'libelle': 'Looker', 'exigence': 'E'}, {'libelle': 'NoSQL', 'exigence': 'S'}, {'libelle': 'Power BI', 'exigence': 'E'}, {'libelle': 'Python', 'exigence': 'E'}, {'libelle': 'SQL', 'exigence': 'E'}, {'libelle': 'SpaCy', 'exigence': 'S'}, {'libelle': 'StatsModels', 'exigence': 'S'}, {'libelle': 'Trello', 'exigence': 'S'}]",0.959804117679596
Docteur en Data Science (H/F),"Vos missions :

Rattaché à notre pôle Ingénierie, vous serez en charge de la recherche fondamentale et appliquée, du développement expérimental ainsi que de la consolidation des dossiers techniques CIR/CII et des relations avec les partenaires externes.

Par conséquent, vos principales missions seront les suivantes :
-	Participation aux projets R&D visant l'exploitation avancée des données collectées par Élap en y apportant votre rigueur et votre méthodologie de chercheur.
-	Analyse de données et création de modèles prédictifs couvrant les domaines de toutes nos solutions logicielles : Finance, RH, Planning, Recrutement 
-	Coordination des échanges et des travaux avec les partenaires externes tels que les laboratoires de recherche en psychologie, santé, gestion  et cabinets d'aides publiques.
-	Supervision et consolidation des dossiers techniques CIR et CII. 

A titre d'exemple, voici quelques sujets sur lesquels, vous travaillerez : 
-	Analyse prédictive des flux comptables et budgétaires : affectation de dépenses, détection de fraudes, prévention des dérives de pratiques comptables...
-	Intégration d'indicateurs psychologiques et forces motivationnelles dans les processus de recrutement, d'on-boarding, de planification 
-	Détection et prévention du burn-out et prévision d'absentéisme.


Votre profil :

Vous êtes récemment diplômé d'un Doctorat en Data Science ou IA et vous êtes à la recherche de votre 1er emploi en tant que Docteur. 
Vous avez donc 3 ans d'expérience en tant que Doctorant et vous venez de passer votre thèse de doctorat.

Vous possédez les compétences suivantes :
-	Connaissance approfondie des méthodologies de recherche en Data Science et IA.
-	Solides compétences en langages de programmation tels que Python, R et des outils associés : NumPy, Pandas, Scikit-Learn, TensorFlow, PyTorch  
-	Expérience significative dans le développement et l'application de modèles de Machine Learning.
-	Excellentes compétences en communication et en rédaction scientifique.
-	Capacité à travailler de manière autonome et à collaborer efficacement au sein d'une équipe multidisciplinaire.


Conditions et Avantages :

Poste en CDI ou CDD 39h avec 10 jours de RTT. Statut CADRE. Rémunération à définir. 
Prime pour les déplacements professionnels + Prime vacances conventionnelle + Prime d'intéressement avec possibilité de placement sur un Plan Epargne Entreprise (PEE). Prime de cooptation. Prime PPV.
Carte Titres Restaurant et mutuelle attractive.

Poste basé dans nos bureaux de Paris-La Défense (92). Plusieurs jours de télétravail par semaine selon les usages de l'entreprise. Déplacements 1 fois par mois à prévoir dans nos différents bureaux : Lille dans le Nord (59) et Brignoles dans le Var (83).",Études et prospectives socio-économiques,"[{'code': '109527', 'libelle': 'Adapter les outils de traitement statistique de données', 'exigence': 'S'}, {'code': '109529', 'libelle': 'Présenter et diffuser les résultats des études réalisées', 'exigence': 'S'}, {'code': '300457', 'libelle': ""Définir et faire évoluer des procédés de traitement de l'information"", 'exigence': 'S'}]",0.9596329927444458
TEAM LEADER (H/F),"Systnaps - Editeur français de logiciels, expert du Data Management depuis 17 ans, nos solutions uniques et innovantes accélèrent la transformation digitale de toutes les organisations pilotées par la donnée.

Rattaché(e) directement au fondateur, ton rôle est d'être actrice /acteur sur différentes missions :
Vous serez en charge de :
-	Gérer un groupe d'ingénieurs en conception logicielle (activités de suivi, entretiens annuels, réunions, objectifs...
-	Affecter le personnel de l'équipe aux activités du projet
-	Assurer un bon niveau d'IRC en ce qui concerne les jalons
-	Coordonner entre les équipes de R&D et les équipes intégrées
-	Soutien à la gestion, démonstrations, proposition de feuille de route, rapports de projet et risques
-	Contribuer au recrutement des membres (ingénieurs & stages) du département SW AI.
-	Définir le plan de formation pour chaque ingénieur.
-	Proposer et améliorer les schémas logiciels et de conception de nos cadres logiciels centraux pour les réseaux neuronaux
-	Développer des modules logiciels pour les applications d'apprentissage automatique, principalement en python et C/C++
-	Proximité des ingénieurs R&D pour les commentaires et la mise en œuvre des exemples d'utilisation
-	Contribuer et améliorer les normes de codage logiciel (PEP8 et révisions de code)
-	Créer des tests logiciels automatisés pour une intégration continue
-	Analyser et optimiser l'efficacité logicielle (analyse d'exécution, multithreading)
-	participer à des projets innovants avec nos experts.

Incontournables
-	Expériences réussies en méthode agile ;
-	Expérimenté(e) en développement web ;
-	Langages et frameworks suivants : 
Framework Symfony, REST API, MongoDB, Node JS, Angular, Linux, Git, Gitlab, DevOps 
-	Bonnes pratiques - versionning - tests - CI/CD - ;
-	Gérer des équipes et as une expérience poussée d'interactions régulières et réussies avec une team produit ;
-	Développer et travailler sur une roadmap tech et  faire des trade-offs, les justifier, les communiquer et les faire adopter ;
-	Expérience minimum de 5 + années en dev full stack, nécessaires.
-	Expérience réussie dans le monde des marketplaces,  
-	Connaissance du principe de la Blockchain
-	Gérer une équipe de dev full stack
-	Expérience dans le domaine de l'analyse de données serait un plus

DIPLOME/EXPERIENCE  : 
-	Vous êtes diplômé(e) d'un Bac +5 en ingénierie, vous justifiez de minimum 5 ans d'expérience en logicielle  
-	Vous avez une expérience significative en conception de modèles et architectures de conception logiciels
-	Vous êtes curieux et ouvert d'esprit et vous avez un bon sens de la communication et du travail d'équipe
-	Vous avez des connaissances en maintenance de Serveurs informatique de stockage (LINUX, Google Coud Plateform...
-	Force de proposition
-	Bonne capacité d'analyse et d'organisation",Études et développement informatique,"[{'code': '300688', 'libelle': 'Application web', 'exigence': 'E'}, {'code': '109846', 'libelle': 'Concevoir une application web', 'exigence': 'E'}]",0.9581394195556641
Data analyst (H/F),"Barrière, c'est 33 Casinos, 1 Club de Jeux, 19 Hôtels, plus de 120 Restaurants et Bars, 15 Spas, 3 Golfs, 2 Tennis Club, 1 Balnéo, 1 Thalasso. Barrière, c'est aussi 50 métiers incarnés par près de 7000 collaborateurs, en France et à l'international. Et par vous aussi demain  

    Contexte & Lieu de travail, pour briller en entretien

Sous la responsabilité de notre Responsable de domaine Data, rattaché(e) à la Direction Data & Acquisition, vous contribuerez à la définition de la roadmap data pour les activités du groupe et assurerez la réalisation et la livraison des cas d'usage d'exploitation de données ou d'Intelligence artificielle, identifiés avec les différentes directions métiers (marketing, commerciales, jeux, hôtellerie... )

    Vos missions si vous l'acceptez

Le/la Data Product Owner sera en charge de la gestion des projets de la roadmap Data avec un focus particulier sur nos activités de Jeux online.

Il/elle est chargé(e) de :
Identifier et collecter les besoins des directions métiers afin d'évaluer par la data les différentes opportunités ;
Proposer des modèles statistiques ou de machine learning pour améliorer l'expérience client et la productivité des collaborateurs ;
Piloter  la rédaction des backlog data liés aux différents produits afin d'assurer la cohérence et le développement des cas d'usage data (segmentations et scoring clients, clustering produit, modèles de recommandation...) ;
Analyser les performances des cas d'usage déployés en définissant au préalable les métriques à suivre et Kpis de succès et de coordonner les reportings associés avec nos équipes BI ;
Réaliser une veille concurrentielle pour assurer la mise en place des meilleures pratiques marché sur nos sites web et outils d'aide à la décision.

En lien permanent avec les équipes Produit, les développeurs et designers des sites Web, les Data analysts, les Data scientists, le Data Product Owner devra :
Piloter le développement et le déploiement des cas d'usage sur les plateformes Data ;
Organiser et coordonner l'implémentation ou l'exposition de ces cas d'usage au sein des différents sites WEB du groupe.
  
   Votre bon Profil

Vous avez :
une ou plusieurs expérience dans le data product owner et êtes familier des méthodologies agiles ;
de bonnes connaissances techniques et une bonne compréhension des plateformes et écosystèmes Big Data ;
de fortes compétences en management et gestion de projet ;
une compréhension parfaite des enjeux du traitement des données et du potentiel de la data en général afin de développer une vision stratégique et identifier des axes de développement ;
une bonne maîtrise des fondamentaux statistiques et ML (modèles classiques, technique de tests statistiques, métriques d'optimisation courantes...) ;
des bases avancées en langage SQL ;
2-3 années d'expériences dans le secteur du jeu en ligne seraient fortement appréciées.

Vous êtes :
diplômé(e) d'une formation supérieure en informatique bac + 4/5 ;
doté d'une grande capacité d'écoute et d'un bon relationnel ;
pourvu d'un esprit de synthèse et d'analyse ;
organisé(e), rigoureux(se), méthodique ;
à l'aise dans l'animation ;
curieux(se) et autonome.

  Nos pétillances

Des bureaux modernes, connectés, avec une salle de sport ;
Le 13ème mois ;
Une Charte télétravail autorisant jusqu'à 3 jours par semaine ;
L'opportunité de suivre des formations (métiers, produits, d'empowerment...) ;
Un accompagnement personnalisé pour développer votre potentiel et évoluer au sein de notre Groupe ;
Des tarifs collaborateurs pour se faire des week-ends de rêve.

Faire vivre des moments exceptionnels à nos clients, voilà votre future raison d'être.
Barrière, 50 métiers, 1 seul état d'esprit. N'hésitez plus, rejoignez-nous !",Études et prospectives socio-économiques,,0.9577409029006958
Analyste Business Intelligence et Stratégie Commerciale  F/H - La Compagnie (H/F),"La Compagnie recrute, en contrat à durée indéterminée, un(e) analyste Business Intelligence et Stratégie Commerciale.
 
 
 
Vos missions
 
 
 
Rattaché(e) à la Direction Business Intelligence, l'analyste Business Intelligence et Stratégie Commercial aura pour mission de :
 
 
 
Business Intelligence :
 
 
 
         Participer activement au développement de rapports d'analyse et d'aide à la prise de décision et contribuer à une logique d'intelligence d'affaires dans les projets de la société,
 
         Contribuer à l'analyse des besoins fonctionnels et techniques de chaque département de la société  et proposer des rapports d'aide à la prise de décision efficaces,
 
         Aider à la création de rapports ad hoc pour répondre aux demandes spécifiques des départements et des parties prenantes internes, dont la Direction Générale et la Direction Financière,
 
         Participer à la mise en place d'un écosystème de données robuste et efficace. Rendre l'accès aux données plus simple et intuitif pour les différentes équipes concernées,
 
         Assister à la mise en place de processus d'automatisation pour la collecte, le nettoyage et l'analyse des données, afin d'améliorer l'efficacité opérationnelle,
 
         Assurer la qualité et l'intégrité des données en mettant en place des contrôles réguliers et des procédures de validation,
 
         Participer à la formation des utilisateurs finaux sur les outils et les processus liés à la Business Intelligence pour favoriser l'adoption et l'utilisation efficace des solutions déployées par l'activité.
 
 
 
Business Developpment :
 
 
 
         Contribuer à la réflexion et à l'exécution d'analyses poussant les différents départements techniques et opérationnels vers une optimisation de la performance de la société,
 
         Assister à la structuration et l'établissement d'une veille permettant une analyse claire du marché et de la conjoncture économique concernant l'activité de transport commercial de la société,
 
         Collaborer avec les équipes internes pour développer des analyses personnalisées et des solutions sur mesure en réponse aux besoins,
 
         Participer à la traduction de l'ambition stratégique de l'entreprise en plan d'actions pour les activités de ventes, en explicitant et justifiant les facteurs clés de succès associés,
 
         Collaborer à la définition et à l'accompagnement de la conduite du plan commercial stratégique de l'entreprise,
 
         Participer à la conception et à l'accompagnement de l'implémentation de nouvelles initiatives commerciales et de partenariats stratégiques,
 
         Contribuer activement au pilotage de la performance et des projets commerciaux clés de l'entreprise ainsi qu'à la réalisation des chiffres d'affaires associés au business plan.
 
 
 
Ces missions ne sont pas exhaustives et évolueront en fonction des besoins de l'entreprise.
Vous êtes issu(e) d'un cursus Bac+5 en ingénierie / commerce / informatique, spécialisation : MIAGE / BI & Analytics / Data Sciences & Business Analytics .
  
 Votre expérience antérieure atteste de votre capacité à concevoir et déployer des outils de reporting et de pilotage, contribuant ainsi à l'amélioration des performances globales. Vous excellez dans l'interprétation des besoins métier pour élaborer des tableaux de bord pertinents. Votre aptitude à analyser les données chiffrées vous permet de produire des rapports clairs, visuellement impactant et facilement compréhensibles par un public varié.
  
 Votre maîtrise avancée des outils Microsoft Office, notamment Excel et Power BI, combinée à votre intérêt pour les solutions de gestion de données, constitue un atout essentiel. Une connaissance supplémentaire en Power Query, Python, R ou SQL serait fortement appréciée.
  
 Doté d'un sens aigu de l'organisation, d'un business sense, d'une grande proactivité et d'un esprit d'équipe affirmé, vous êtes prêt à exceller dans ce rôle.
  
 Une maîtrise de l'anglais, à l'écrit comme à l'oral, est indispensable pour ce poste.
  
 Alors rejoignez-nous !
  
 
Nature du contrat :                   Contrat à durée indéterminée
 
Rémunération :                        A déterminer
 
Localisation du poste :             Arcueil (94)
 
Démarrage :                            Asap",Études et prospectives socio-économiques,,0.9574233889579773
